{
  "registry_kind": "kraken_r_architecture",
  "registry_id": "kraken-r-foundation",
  "version": "1.12.0",
  "last_reviewed": "2026-08-30",
  "authority_boundary": {
    "legacy_reference": "rogal_core.daemon.ROGALDaemon and rogal_core.autonomous_cycle.AutonomousCycle remain the deployed reference runtime.",
    "kraken_candidate": "The deterministic Kraken-R cycle, read-only recorded-execution replay, bounded in-memory signal propagation, advisory bounded physiology, settlement-grounded bounded route preference, grounded bounded adaptive reducers, immutable replayable dynamical ticks, immutable task-integrity inspection, proof-carrying cognition processing, disposable isolated Orzhaal experiments, proposal-only LLM adapter, verified bounded execution observer, and static interaction validation are executable candidate infrastructure only; they have no authority over the deployed runtime.",
    "preservation": "Legacy, alternate, dormant, and forgotten mechanisms are classified and preserved, never deleted by this foundation."
  },
  "mechanisms": [
    {
      "mechanism_id": "kraken_r_foundation",
      "category": "core_execution",
      "name": "Kraken-R constitutional foundation",
      "intended_role": "Candidate-only vocabulary, architecture census, and inspection boundary.",
      "current_status": "infrastructure",
      "dependencies": [],
      "authority": "kraken_candidate",
      "evidence_grade": "implemented",
      "evidence_refs": ["kraken_r/contracts.py", "kraken_r/registry.py"],
      "duplicates": [],
      "disposition": "keep",
      "source_refs": ["Task #50", "docs/kraken_r/CONSTITUTION.md"],
      "planned": false,
      "notes": "No runtime loop, writer, subscriber, or actuator is provided."
    },
    {
      "mechanism_id": "kraken_r_constitutional_cycle",
      "category": "core_execution",
      "name": "Deterministic constitutional cycle",
      "intended_role": "Execute one bounded candidate objective through observed evidence, settlement, learning, and an explicit stop.",
      "current_status": "infrastructure",
      "dependencies": ["kraken_r_foundation"],
      "authority": "kraken_candidate",
      "evidence_grade": "implemented",
      "evidence_refs": ["kraken_r/cycle.py", "kraken_r/validate.py"],
      "duplicates": [],
      "disposition": "keep",
      "source_refs": ["docs/kraken_r/CONSTITUTION.md"],
      "planned": false,
      "notes": "Pure in-memory candidate fixture; it never imports or mutates the legacy runtime."
    },
    {
      "mechanism_id": "kraken_r_recorded_execution_replay",
      "category": "core_execution",
      "name": "Recorded-execution constitutional replay",
      "intended_role": "Replay one immutable observed execution record through the candidate cycle without live runtime access.",
      "current_status": "infrastructure",
      "dependencies": ["kraken_r_constitutional_cycle"],
      "authority": "kraken_candidate",
      "evidence_grade": "implemented",
      "evidence_refs": ["kraken_r/replay.py", "kraken_r/validate.py", "tests/test_kraken_r_replay.py"],
      "duplicates": [],
      "disposition": "keep",
      "source_refs": ["docs/kraken_r/CONSTITUTION.md", "docs/kraken_r/SALVAGE_DECISIONS.md"],
      "planned": false,
      "notes": "Pure in-memory adapter: immutable records are validated for identity, state version, provenance, and observed evidence before replay; no EventBus, router, store, or legacy import is used."
    },
    {
      "mechanism_id": "round_three_salvage_decision_record",
      "category": "operator_surfaces",
      "name": "Round-three salvage decision record",
      "intended_role": "Preserve the refinement-trace disposition and non-promotion blockers for nervous-system salvage candidates.",
      "current_status": "infrastructure",
      "dependencies": [],
      "authority": "documentation_only",
      "evidence_grade": "implemented",
      "evidence_refs": ["docs/kraken_r/SALVAGE_DECISIONS.md"],
      "duplicates": [],
      "disposition": "keep",
      "source_refs": [".gitignore", "docs/kraken_r/SALVAGE_DECISIONS.md"],
      "planned": false,
      "notes": "The deleted refinement traces remain in Git history and are intentionally not restored; legacy nervous-system mechanisms remain preserved and quarantined from candidate authority until their recorded blockers are resolved."
    },
    {
      "mechanism_id": "kraken_r_bounded_nervous_system",
      "category": "emergence_routing",
      "name": "Bounded deterministic candidate signal propagation",
      "intended_role": "Propagate canonical declared signals through fixed candidate-only rules with task-state/provenance, source/cause, and priority binding; TTL, stable deduplication, supported-topic rejection, finite budgets, and explicit inhibition or amplification.",
      "current_status": "infrastructure",
      "dependencies": ["kraken_r_constitutional_cycle"],
      "authority": "kraken_candidate",
      "evidence_grade": "implemented",
      "evidence_refs": ["kraken_r/nervous_system.py", "kraken_r/cycle.py", "tests/test_kraken_r_nervous_system.py", "kraken_r/validate.py"],
      "duplicates": [],
      "disposition": "keep",
      "source_refs": ["docs/kraken_r/CONSTITUTION.md", "docs/kraken_r/SALVAGE_DECISIONS.md"],
      "planned": false,
      "notes": "Pure in-memory candidate infrastructure. It extends the canonical Signal/Event alias rather than creating a second transport authority; signals are declared messages, never evidence or truth. Candidate delivery requires explicit source, cause, and integer priority; equal-tick delivery orders higher priority first and then signal_id, while unknown topics reject before delivery. Rules are static and deterministic: no learning, persistence, subscriptions, adaptive selection, or legacy imports."
    },
    {
      "mechanism_id": "kraken_r_bounded_physiology",
      "category": "homeostasis_health",
      "name": "Bounded advisory candidate physiology",
      "intended_role": "Evaluate one explicit immutable internal-condition snapshot and conservatively inhibit a candidate action during recovery or critical operating regimes.",
      "current_status": "infrastructure",
      "dependencies": ["kraken_r_constitutional_cycle"],
      "authority": "kraken_candidate",
      "evidence_grade": "implemented",
      "evidence_refs": ["kraken_r/physiology.py", "kraken_r/cycle.py", "tests/test_kraken_r_physiology.py", "kraken_r/validate.py"],
      "duplicates": [],
      "disposition": "keep",
      "source_refs": ["docs/kraken_r/CONSTITUTION.md", "docs/kraken_r/SALVAGE_DECISIONS.md", "rogal_core/emergence/pressure_field.py", "rogal_core/health/homeostasis.py", "rogal_core/cognition/resources.py"],
      "planned": false,
      "notes": "Pure in-memory adapter of normalized pressure, threshold/hysteresis, contradiction/backlog, and protected-reserve concepts. It imports no legacy mechanism and has no live sensor, queue, router, evidence, settlement, learning, persistence, lifecycle, or goal-selection authority. Its only allowed effect is an explicit, replayable candidate-action inhibition before fixture execution."
    },
    {
      "mechanism_id": "kraken_r_settlement_grounded_plastic_routing",
      "category": "emergence_routing",
      "name": "Settlement-grounded bounded candidate route preference",
      "intended_role": "Select a deterministic candidate organizational edge and apply a fixed bounded preference adjustment only after one provenance-bound constitutional settlement with grounded execution evidence.",
      "current_status": "infrastructure",
      "dependencies": ["kraken_r_constitutional_cycle", "kraken_r_recorded_execution_replay"],
      "authority": "kraken_candidate",
      "evidence_grade": "implemented",
      "evidence_refs": ["kraken_r/plastic_routing.py", "tests/test_kraken_r_plastic_routing.py", "kraken_r/validate.py"],
      "duplicates": [],
      "disposition": "keep",
      "source_refs": ["docs/kraken_r/CONSTITUTION.md", "docs/kraken_r/SALVAGE_DECISIONS.md", "rogal_core/emergence/plasticity.py", "rogal_core/emergence/pathway_tracker.py", "rogal_core/emergence/topology_tracker.py", "rogal_core/emergence/learning_integration.py", "rogal_core/emergence/online_learning.py"],
      "planned": false,
      "notes": "Pure immutable reducer, not a router or controller. It adapts bounded strengthening/weakening, route topology, auditable pathway lineage, and reset concepts while rejecting legacy stores, globals, clocks, background loops, signal confidence, broad credit assignment, and cross-run persistence. Only settled task_success/task_failure with matching verified child-runtime, record, and execution-class provenance may adjust the selected route by a fixed bounded delta; setup/infrastructure, timeout/resource, execution, contradiction, insufficient-evidence, declared claims, stale selections, malformed provenance, and duplicate in-window settlements fail closed or explicitly withhold learning."
    },
    {
      "mechanism_id": "kraken_r_bounded_adaptive_substrate",
      "category": "emergence_routing",
      "name": "Grounded bounded candidate adaptive substrate",
      "intended_role": "Apply deterministic, local, generation-bounded route, connection, rollback, and tactic adjustments only after an independently reverified grounded constitutional settlement.",
      "current_status": "infrastructure",
      "dependencies": ["kraken_r_settlement_grounded_plastic_routing", "kraken_r_bounded_physiology"],
      "authority": "kraken_candidate",
      "evidence_grade": "implemented",
      "evidence_refs": ["kraken_r/adaptive_substrate.py", "tests/test_kraken_r_adaptive_substrate.py", "kraken_r/validate.py"],
      "duplicates": [],
      "disposition": "keep",
      "source_refs": ["docs/kraken_r/CONSTITUTION.md", "docs/kraken_r/README.md"],
      "planned": false,